CLOS_YM,JHNT_MBN,JHNT_CTN,JHCR_DE,JHNT_CLOS_DE,FRFT_AFTR_JHNT_REQR_DYCT,JHNT_RQUT_CHNL_SECD,INFO_OTPB_GRAD_CD,MDTN_HOPE_GRD_CD,IDIF_AOFR_YN,EMAIL_RCYN,EMPL_STLE_CD,DSPT_LABR_YN,COMM_WAGE_TYCD,HOPE_WAGE_SM_AMT,AFIV_RDJT_PSBL_YN,HOPE_JSCD1,HOPE_JSCD2,HOPE_JSCD3,HPAR_CD1,HPAR_CD2,HPAR_CD3,CYC1,CARR_MYCT1,CYC2,CARR_MYCT2,CYC3,CARR_MYCT3,ACCR_STCD,ACCR_CD,DRV_PSBL_YN,AGE,SAEIL_CNTC_AGRE_YN,SHRS_IDIF_AOFR_YN,SULC_IDIF_AOFR_YN,IDIF_IQRY_AGRE_YN,DLY_LABR_HOPE_YN,RQAG_HOPE_YN,SHSY_YN,MDTN_HOPE_YN,JHNT_PPOS_CD,SXDS_CD,SMS_RCYN,EMAIL_OTPB_YN,MPNO_OTPB_YN,MAJR_CD1,BFR_WTM6_JHCR_CT,BFR_UEPS_RECP_CT,UEPS_RECP_YN,BFR_EJAP_CT,SFID_WRTN_AFTR_ELPS_DYCT,SFID_IEM_NUM,SFID_LTTR_NUM,BFR_PSIS_ELPS_DYCT,BFR_RLTY_SNSC,BFR_IVTG_SNSC,BFR_ARTY_SNSC,BFR_SCTY_SNSC,BFR_EPTY_SNSC,BFR_CSTP_SNSC,BFR_INTS_CD2,AREA_CD,HPAR_CSCY_SCOR,BFR_OCTR_YN,BFR_OCTR_CT,KECO_CD1,OCTR_HOPE_JSFC_CSCY_SCOR1,OCTR_HOPE_JSFC_CSCY_SCOR2,IPS_IRDS_NMPR,JBHT_NMPR,RCIT_NMPR,JO_DRNG_RATE,AVG_OTIO_MYAV_RMNT_AMT,AVG_HOPE_WAGE_SM_AMT,CRQF_CT,ETL_DT,MAKE_DT,ACQ_180_YN,ACQ_DT,MATCH_L_YN,MATCH_M_YN,MATCH_S_YN,LAST_JSCD,EMPN_DE,LAST_FRFT_DE,TMPL_SEQNO_1,TMPL_SEQNO_2,TMPL_SEQNO_3,TMPL_SEQNO_4,TMPL_SEQNO_5,TMPL_SEQNO_6,TMPL_SEQNO_7,RESUME_TITLE_1,RESUME_TITLE_2,RESUME_TITLE_3,RESUME_TITLE_4,RESUME_TITLE_5,RESUME_TITLE_6,RESUME_TITLE_7,BASIC_RESUME_YN_1,BASIC_RESUME_YN_2,BASIC_RESUME_YN_3,BASIC_RESUME_YN_4,BASIC_RESUME_YN_5,BASIC_RESUME_YN_6,BASIC_RESUME_YN_7,RESUME_ITEM_CLCD_1,RESUME_ITEM_CLCD_2,RESUME_ITEM_CLCD_3,RESUME_ITEM_CLCD_4,RESUME_ITEM_CLCD_5,RESUME_ITEM_CLCD_6,RESUME_ITEM_CLCD_7,DS_RESUME_ITEM_CLCD_1,DS_RESUME_ITEM_CLCD_2,DS_RESUME_ITEM_CLCD_3,DS_RESUME_ITEM_CLCD_4,DS_RESUME_ITEM_CLCD_5,DS_RESUME_ITEM_CLCD_6,DS_RESUME_ITEM_CLCD_7,SEQNO_1,SEQNO_2,SEQNO_3,SEQNO_4,SEQNO_5,SEQNO_6,SEQNO_7,RESUME_ITEM_1_CD_1,RESUME_ITEM_1_CD_2,RESUME_ITEM_1_CD_3,RESUME_ITEM_1_CD_4,RESUME_ITEM_1_CD_5,RESUME_ITEM_1_CD_6,RESUME_ITEM_1_CD_7,DS_RESUME_ITEM_1_CD_1,DS_RESUME_ITEM_1_CD_2,DS_RESUME_ITEM_1_CD_3,DS_RESUME_ITEM_1_CD_4,DS_RESUME_ITEM_1_CD_5,DS_RESUME_ITEM_1_CD_6,DS_RESUME_ITEM_1_CD_7,RESUME_ITEM_2_CD_1,RESUME_ITEM_2_CD_2,RESUME_ITEM_2_CD_3,RESUME_ITEM_2_CD_4,RESUME_ITEM_2_CD_5,RESUME_ITEM_2_CD_6,RESUME_ITEM_2_CD_7,DS_RESUME_ITEM_2_CD_1,DS_RESUME_ITEM_2_CD_2,DS_RESUME_ITEM_2_CD_3,DS_RESUME_ITEM_2_CD_4,DS_RESUME_ITEM_2_CD_5,DS_RESUME_ITEM_2_CD_6,DS_RESUME_ITEM_2_CD_7,RESUME_ITEM_3_CD_1,RESUME_ITEM_3_CD_2,RESUME_ITEM_3_CD_3,RESUME_ITEM_3_CD_4,RESUME_ITEM_3_CD_5,RESUME_ITEM_3_CD_6,RESUME_ITEM_3_CD_7,DS_RESUME_ITEM_3_CD_1,DS_RESUME_ITEM_3_CD_2,DS_RESUME_ITEM_3_CD_3,DS_RESUME_ITEM_3_CD_4,DS_RESUME_ITEM_3_CD_5,DS_RESUME_ITEM_3_CD_6,DS_RESUME_ITEM_3_CD_7,RESUME_ITEM_4_CD_1,RESUME_ITEM_4_CD_2,RESUME_ITEM_4_CD_3,RESUME_ITEM_4_CD_4,RESUME_ITEM_4_CD_5,RESUME_ITEM_4_CD_6,RESUME_ITEM_4_CD_7,DS_RESUME_ITEM_4_CD_1,DS_RESUME_ITEM_4_CD_2,DS_RESUME_ITEM_4_CD_3,DS_RESUME_ITEM_4_CD_4,DS_RESUME_ITEM_4_CD_5,DS_RESUME_ITEM_4_CD_6,DS_RESUME_ITEM_4_CD_7,RESUME_ITEM_1_NM_1,RESUME_ITEM_1_NM_2,RESUME_ITEM_1_NM_3,RESUME_ITEM_1_NM_4,RESUME_ITEM_1_NM_5,RESUME_ITEM_1_NM_6,RESUME_ITEM_1_NM_7,RESUME_ITEM_2_NM_1,RESUME_ITEM_2_NM_2,RESUME_ITEM_2_NM_3,RESUME_ITEM_2_NM_4,RESUME_ITEM_2_NM_5,RESUME_ITEM_2_NM_6,RESUME_ITEM_2_NM_7,RESUME_ITEM_3_NM_1,RESUME_ITEM_3_NM_2,RESUME_ITEM_3_NM_3,RESUME_ITEM_3_NM_4,RESUME_ITEM_3_NM_5,RESUME_ITEM_3_NM_6,RESUME_ITEM_3_NM_7,RESUME_ITEM_1_VAL_1,RESUME_ITEM_1_VAL_2,RESUME_ITEM_1_VAL_3,RESUME_ITEM_1_VAL_4,RESUME_ITEM_1_VAL_5,RESUME_ITEM_1_VAL_6,RESUME_ITEM_1_VAL_7,HIST_STDT_1,HIST_STDT_2,HIST_STDT_3,HIST_STDT_4,HIST_STDT_5,HIST_STDT_6,HIST_STDT_7,HIST_ENDT_1,HIST_ENDT_2,HIST_ENDT_3,HIST_ENDT_4,HIST_ENDT_5,HIST_ENDT_6,HIST_ENDT_7,HIST_ITEM_GRDCD_1,HIST_ITEM_GRDCD_2,HIST_ITEM_GRDCD_3,HIST_ITEM_GRDCD_4,HIST_ITEM_GRDCD_5,HIST_ITEM_GRDCD_6,HIST_ITEM_GRDCD_7,DS_HIST_ITEM_GRDCD_1,DS_HIST_ITEM_GRDCD_2,DS_HIST_ITEM_GRDCD_3,DS_HIST_ITEM_GRDCD_4,DS_HIST_ITEM_GRDCD_5,DS_HIST_ITEM_GRDCD_6,DS_HIST_ITEM_GRDCD_7,ETC_ITEM_CONT_1,ETC_ITEM_CONT_2,ETC_ITEM_CONT_3,ETC_ITEM_CONT_4,ETC_ITEM_CONT_5,ETC_ITEM_CONT_6,ETC_ITEM_CONT_7,CAREER_MMCNT_1,CAREER_MMCNT_2,CAREER_MMCNT_3,CAREER_MMCNT_4,CAREER_MMCNT_5,CAREER_MMCNT_6,RESUME_ITEM_5_NM_1,RESUME_ITEM_5_NM_2,RESUME_ITEM_5_NM_3,RESUME_ITEM_5_NM_4,RESUME_ITEM_5_NM_5,RESUME_ITEM_5_NM_6,RESUME_ITEM_5_NM_7,COMP_NM_OPEN_YN_1,COMP_NM_OPEN_YN_2,COMP_NM_OPEN_YN_3,COMP_NM_OPEN_YN_4,COMP_NM_OPEN_YN_5,COMP_NM_OPEN_YN_6,JSCD_1,JSCD_2,JSCD_3,JSCD_4,JSCD_5,JSCD_6,SLRY_AMT_1,SLRY_AMT_2,SLRY_AMT_3,SLRY_AMT_4,SLRY_AMT_5,SLRY_AMT_6,EMMD_OCCP_CL_YEAR_1,EMMD_OCCP_CL_YEAR_2,EMMD_OCCP_CL_YEAR_3,EMMD_OCCP_CL_YEAR_4,EMMD_OCCP_CL_YEAR_5,EMMD_OCCP_CL_YEAR_6,SFID_NO_1,SFID_NO_2,SFID_NO_3,SFID_NO_4,SFID_NO_5,SFID_NO_6,SFID_NO_7,SFID_NO_8,SFID_NO_9,SFID_NO_10,SFID_NO_11,SFID_NO_12,SFID_NO_13,SFID_NO_14,SFID_NO_15,SFID_NO_16,SFID_NO_17,SFID_NO_18,SFID_NO_19,SFID_NO_20,BASS_SFID_YN_1,BASS_SFID_YN_2,BASS_SFID_YN_3,BASS_SFID_YN_4,BASS_SFID_YN_5,BASS_SFID_YN_6,BASS_SFID_YN_7,BASS_SFID_YN_8,BASS_SFID_YN_9,BASS_SFID_YN_10,BASS_SFID_YN_11,BASS_SFID_YN_12,BASS_SFID_YN_13,BASS_SFID_YN_14,BASS_SFID_YN_15,BASS_SFID_YN_16,BASS_SFID_YN_17,BASS_SFID_YN_18,BASS_SFID_YN_19,BASS_SFID_YN_20,SFID_IEM_SN_1,SFID_IEM_SN_2,SFID_IEM_SN_3,SFID_IEM_SN_4,SFID_IEM_SN_5,SFID_IEM_SN_6,SFID_IEM_SN_7,SFID_IEM_SN_8,SFID_IEM_SN_9,SFID_IEM_SN_10,SFID_IEM_SN_11,SFID_IEM_SN_12,SFID_IEM_SN_13,SFID_IEM_SN_14,SFID_IEM_SN_15,SFID_IEM_SN_16,SFID_IEM_SN_17,SFID_IEM_SN_18,SFID_IEM_SN_19,SFID_IEM_SN_20,SFID_SJNM_1,SFID_SJNM_4,SFID_SJNM_5,SFID_SJNM_7,SFID_SJNM_8,SFID_SJNM_9,SFID_SJNM_10,SFID_SJNM_11,SFID_SJNM_12,SFID_SJNM_13,SFID_SJNM_14,SFID_SJNM_15,SFID_SJNM_16,SFID_SJNM_17,SFID_IEM_SECD_1,SFID_IEM_SECD_2,SFID_IEM_SECD_3,SFID_IEM_SECD_4,SFID_IEM_SECD_5,SFID_IEM_SECD_6,SFID_IEM_SECD_7,SFID_IEM_SECD_8,SFID_IEM_SECD_9,SFID_IEM_SECD_10,SFID_IEM_SECD_11,SFID_IEM_SECD_12,SFID_IEM_SECD_13,SFID_IEM_SECD_14,SFID_IEM_SECD_15,SFID_IEM_SECD_16,SFID_IEM_SECD_17,SFID_IEM_SECD_18,SFID_IEM_SECD_19,SFID_IEM_SECD_20,DS_SFID_IEM_SECD_1,DS_SFID_IEM_SECD_2,DS_SFID_IEM_SECD_3,DS_SFID_IEM_SECD_4,DS_SFID_IEM_SECD_5,DS_SFID_IEM_SECD_6,DS_SFID_IEM_SECD_7,DS_SFID_IEM_SECD_8,DS_SFID_IEM_SECD_9,DS_SFID_IEM_SECD_10,DS_SFID_IEM_SECD_11,DS_SFID_IEM_SECD_12,DS_SFID_IEM_SECD_13,DS_SFID_IEM_SECD_14,DS_SFID_IEM_SECD_15,DS_SFID_IEM_SECD_16,DS_SFID_IEM_SECD_17,DS_SFID_IEM_SECD_18,DS_SFID_IEM_SECD_19,DS_SFID_IEM_SECD_20,SFID_IEM_SJNM_1,SFID_IEM_SJNM_2,SFID_IEM_SJNM_3,SFID_IEM_SJNM_4,SFID_IEM_SJNM_5,SFID_IEM_SJNM_6,SFID_IEM_SJNM_7,SFID_IEM_SJNM_8,SFID_IEM_SJNM_9,SFID_IEM_SJNM_10,SFID_IEM_SJNM_11,SFID_IEM_SJNM_12,SFID_IEM_SJNM_13,SFID_IEM_SJNM_14,SFID_IEM_SJNM_15,SFID_IEM_SJNM_16,SFID_IEM_SJNM_17,SFID_IEM_SJNM_18,SFID_IEM_SJNM_19,SFID_IEM_SJNM_20,SELF_INTRO_CONT_1,SELF_INTRO_CONT_2,SELF_INTRO_CONT_3,SELF_INTRO_CONT_4,SELF_INTRO_CONT_5,SELF_INTRO_CONT_6,SELF_INTRO_CONT_7,SELF_INTRO_CONT_8,SELF_INTRO_CONT_9,SELF_INTRO_CONT_10,SELF_INTRO_CONT_11,SELF_INTRO_CONT_12,SELF_INTRO_CONT_13,SELF_INTRO_CONT_14,SELF_INTRO_CONT_15,SELF_INTRO_CONT_16,SELF_INTRO_CONT_17,SELF_INTRO_CONT_18,SELF_INTRO_CONT_19,SELF_INTRO_CONT_20,CLOS_YM_1,CLOS_YM_2,CLOS_YM_3,CLOS_YM_4,CLOS_YM_5,CLOS_YM_6,CLOS_YM_7,JHCR_DE_1,JHCR_DE_2,JHCR_DE_3,JHCR_DE_4,JHCR_DE_5,JHCR_DE_6,JHCR_DE_7,CRSE_ID_1,CRSE_ID_2,CRSE_ID_3,CRSE_ID_4,CRSE_ID_5,CRSE_ID_6,CRSE_ID_7,TGCR_TME_1,TGCR_TME_2,TGCR_TME_3,TGCR_TME_4,TGCR_TME_5,TGCR_TME_6,TGCR_TME_7,TRNG_CRSN_1,TRNG_CRSN_2,TRNG_CRSN_3,TRNG_CRSN_4,TRNG_CRSN_5,TRNG_CRSN_6,TRNG_CRSN_7,TRNG_BGDE_1,TRNG_BGDE_2,TRNG_BGDE_3,TRNG_BGDE_4,TRNG_BGDE_5,TRNG_BGDE_6,TRNG_BGDE_7,TRNG_ENDE_1,TRNG_ENDE_2,TRNG_ENDE_3,TRNG_ENDE_4,TRNG_ENDE_5,TRNG_ENDE_6,TRNG_ENDE_7,TRNG_JSCD_1,TRNG_JSCD_2,TRNG_JSCD_3,TRNG_JSCD_4,TRNG_JSCD_5,TRNG_JSCD_6,TRNG_JSCD_7,KECO_CD_1,KECO_CD_2,KECO_CD_3,KECO_CD_4,KECO_CD_5,KECO_CD_6,KECO_CD_7,SORT_SN_1,SORT_SN_2,SORT_SN_3,SORT_SN_4,SORT_SN_5,SORT_SN_6,SORT_SN_7,ETL_DT_1,ETL_DT_2,ETL_DT_3,ETL_DT_4,ETL_DT_5,ETL_DT_6,ETL_DT_7,CLOS_YM_1_license,CLOS_YM_2_license,CLOS_YM_3_license,CLOS_YM_4_license,CLOS_YM_5_license,CRQF_CD_1,CRQF_CD_2,CRQF_CD_3,CRQF_CD_4,CRQF_CD_5,QULF_ITNM_1,QULF_ITNM_2,QULF_ITNM_3,QULF_ITNM_4,QULF_ITNM_5,QULF_LCNS_LCFN_1,QULF_LCNS_LCFN_2,QULF_LCNS_LCFN_3,QULF_LCNS_LCFN_4,QULF_LCNS_LCFN_5,ETL_DT_1_license,ETL_DT_2_license,ETL_DT_3_license,ETL_DT_4_license,ETL_DT_5_license
2022-07,3029086502262,7067002474198,2022-10-06,1,9,온라인,1,19271,1,1,기간제근로계약,1,상용,99,0,242,509,585,36020,68843,98823,99,70,65,84,77,21,중퇴,4년제 대학,1,15,1,0,0,0,0,0,0,19271,직업훈련,남,0,1,0,237,94,93,12,89,191,2,66,301,76,6,30,69,98,97,IS,86480,시도 일치,0,28,6429,중분류 일치,대분류 일치,6,27,59,0.109,39,11,47,868,593,1,467,0,1,0,916,846,955,1,1,1,1.0,1.0,1.0,,OOO님의 이력서입니다.,OOO님의 이력서입니다.,OOO님의 이력서입니다.,OOO님의 이력서입니다.,OOO님의 이력서입니다.,OOO님의 이력서입니다.,,Y,Y,Y,Y,Y,Y,,2,5,7,11,3,9,,훈련,해외연수,전산능력,직업훈련,논문,학력,,1,2,3,4.0,5.0,6.0,,00000000,00000000,3,,00000000,5,,,,문서작성,,,전문대학원,,N,25,,,2,572661,,,해외인턴,,,,컴퓨터공학,,,,,,,127900,,,,,,,산업공학,,,,,,,48,,,,,,,졸업예정,,민간훈련기관,워킹홀리데이,,,머신러닝 기반 수요예측,OO전문대,,ERP 실습,문화교류 프로그램 참여,,,OO대학교,산업공학,,,독일,,,자동화 도입 효과 분석,통계학,,,,,,,,,,1068.0,,,1906.0,551.0,,,703.0,,,,446.0,,,,,,,,,,,,,,,,,기타내용,기타 컴퓨터 활용능력,,,학점 / 총점,,,,,,,,훈련과정,,,,,,,,,,,,,,,,,,,,,,,,,,,,,,,1,1,1,2.0,2.0,2.0,3.0,3.0,3.0,4.0,4.0,4.0,5.0,5.0,5.0,,,,,,Y,Y,Y,N,N,N,N,N,N,N,N,N,N,N,N,,,,,,0,1,2,0.0,1.0,2.0,0.0,1.0,2.0,0.0,1.0,2.0,0.0,1.0,2.0,,,,,,OOO님의 자기소개서 입니다.,OOO님의 자기소개서 입니다.,,OOO님의 자기소개서 입니다.,,,OOO님의 자기소개서 입니다.,,,OOO님의 자기소개서 입니다.,,,,,11,08,03,06,07,10,02,07,07,01,02,99,07,02,07,,,,,,성장과정,성격의 장단점,주요활동,경력 및 업무경험,나의 특장점,입사 후 포부,학창생활,나의 특장점,나의 특장점,나의가족,학창생활,기타,나의 특장점,학창생활,나의 특장점,,,,,,팀워크와 문제 해결로 성과를 이끌어낸 경험이 있습니다.,협력을 통해 성장하며 팀의 성과에 기여하고 있습니다,팀워크와 문제 해결 능력을 통해 성장한 경험을 갖추었습니다.,팀워크와 책임감을 바탕으로 성장하는 전문가입니다,팀워크와 문제 해결 능력으로 조직에 기여하고자 합니다,협력과 소통으로 팀의 시너지를 극대화하겠습니다,팀워크와 문제 해결 능력을 통해 성장한 경험을 가지고 있습니다.,팀워크와 문제 해결 능력으로 조직에 기여하고자 합니다,팀워크와 문제 해결 능력으로 조직에 기여하고자 합니다,가족의 유대감이 저에게 팀워크와 책임감을 심어주었습니다.,팀워크와 문제 해결 능력을 통해 성장한 경험을 가지고 있습니다.,팀워크와 문제 해결 능력을 통해 성장한 경험을 가지고 있습니다.,팀워크와 문제 해결 능력으로 조직에 기여하고자 합니다,팀워크와 문제 해결 능력을 통해 성장한 경험을 가지고 있습니다.,팀워크와 문제 해결 능력으로 조직에 기여하고자 합니다,,,,,,"저는 항상 팀워크와 문제 해결의 중요성을 강조하며 성장해왔습니다. 어린 시절, 다양한 동아리 활동을 통해 친구들과 협력하여 목표를 달성하는 경험을 쌓았습니다. 특히, 중학교 시절 학교 축제 준비를 하면서 팀원들과의 소통과 역할 분담의 중요성을 깨달았습니다. 이러한 경험은 고등학교와 대학에서도 이어졌고, 프로젝트를 수행할 때마다 책임감을 가지고 임하며 문제를 해결하는 데 집중했습니다. 그 결과, 팀이 목표를 초과 달성하는 성과를 이루었고, 이는 저의 성장에 큰 밑거름이 되었습니다. 이러한 경험을 바탕으로 앞으로도 끊임없이 배우고 성장하며, 팀과 함께 더 나은 결과를 만들어 나가고 싶습니다.","저는 긍정적이고 적극적인 성격을 가지고 있어 팀워크를 중요시하며, 언제나 동료들과의 협력을 통해 문제를 해결하려고 노력합니다. 이러한 태도 덕분에 다양한 상황에서도 원활하게 소통하고 조율할 수 있었습니다. 그러나 가끔은 지나치게 책임감을 느껴 혼자서 모든 일을 해결하려고 하는 경향이 있어, 이로 인해 스트레스를 받을 때가 있습니다. 이를 극복하기 위해 팀원들에게 도움을 요청하고 의견을 나누는 연습을 하고 있습니다. 이러한 과정은 저의 성장뿐만 아니라 팀의 성과에도 긍정적인 영향을 미치고 있습니다. 앞으로도 이러한 장점을 살리고 단점을 보완하여 더욱 발전하는 인재가 되겠습니다.","대학 시절, 동아리 활동을 통해 팀워크와 문제 해결 능력을 키웠습니다. 프로젝트를 진행하며 다양한 의견을 조율하고, 각자의 강점을 살려 역할을 분담했습니다. 특히, 한 번은 중요한 발표를 앞두고 예상치 못한 기술적 문제에 직면했으나, 팀원들과의 긴밀한 협력을 통해 신속하게 해결책을 마련했습니다. 이 과정에서 책임감을 느끼며, 결과적으로 발표는 성공적으로 마무리되었습니다. 이러한 경험은 저에게 공동의 목표를 위해 협력하는 것의 중요성과 문제를 해결하는 능력을 배양하는 데 큰 도움이 되었습니다. 또한, 실패와 성공을 통해 지속적으로 성장할 수 있는 기회를 얻었습니다.","저는 다양한 프로젝트에서 팀원으로서의 역할을 충실히 수행하며, 문제 해결 능력을 키워왔습니다. 이전 직장에서 진행한 제품 개발 프로젝트에서는 팀과의 원활한 소통을 통해 고객의 요구사항을 정확히 반영하여 최종 결과물의 품질을 높였습니다. 이 과정에서 발생한 여러 문제를 팀원들과 협력하여 해결하며, 책임감을 갖고 업무에 임했습니다. 또한, 프로젝트 종료 후 피드백을 통해 개인의 성장뿐만 아니라 팀의 역량도 강화할 수 있었습니다. 이러한 경험들은 앞으로의 업무에서도 팀워크와 책임감을 바탕으로 더욱 발전하는 데 큰 도움이 될 것입니다.","저는 다양한 경험을 통해 쌓은 팀워크와 문제 해결 능력을 강점으로 삼고 있습니다. 대학 시절, 여러 프로젝트에서 팀원으로 활동하며 서로의 의견을 존중하고 조율하는 과정에서 협업의 중요성을 깨달았습니다. 또한, 예상치 못한 문제에 직면했을 때는 침착하게 상황을 분석하고, 팀원들과 함께 해결책을 모색하여 성공적으로 프로젝트를 마무리한 경험이 있습니다. 이러한 경험은 저에게 책임감을 더욱 강화시켰고, 지속적인 성장의 기회를 제공했습니다. 앞으로도 이러한 특장점을 바탕으로 조직에 기여하며 함께 발전해 나가고자 합니다.","입사 후, 저는 팀의 일원으로서 협력과 소통을 통해 시너지를 창출하고 싶습니다. 다양한 문제 해결 경험을 바탕으로, 발생하는 이슈에 대해 적극적으로 접근하며 실질적인 해결책을 제시하겠습니다. 또한, 지속적인 자기 개발을 통해 변화하는 시장에 발맞추고, 회사의 성장에 기여할 수 있는 전문가로 성장하겠습니다. 책임감을 가지고 맡은 바 업무를 수행하며, 동료들과 함께 목표를 달성하는 과정에서 신뢰를 쌓고 긍정적인 조직 문화를 만들어 나가겠습니다.","학창 시절, 다양한 활동을 통해 팀워크와 문제 해결 능력을 키웠습니다. 특히, 학급 대표로서 여러 프로젝트를 진행하며 친구들과 협력해 목표를 달성하는 기쁨을 느꼈습니다. 이러한 경험은 저에게 책임감을 심어주었고, 어려운 상황에서도 해결책을 찾는 데 집중할 수 있는 힘을 주었습니다. 또한, 동아리 활동을 통해 서로 다른 의견을 존중하고 조율하는 방법을 배우며 성장할 수 있었습니다. 이 모든 경험은 저의 인성과 능력을 발전시키는 데 큰 도움이 되었고, 앞으로의 도전에서도 이러한 배움을 바탕으로 성과를 이루고자 합니다.","저는 다양한 경험을 통해 쌓은 팀워크와 문제 해결 능력을 강점으로 삼고 있습니다. 대학 시절, 여러 프로젝트에서 팀원으로 활동하며 서로의 의견을 존중하고 조율하는 과정에서 협업의 중요성을 깨달았습니다. 또한, 예상치 못한 문제에 직면했을 때는 침착하게 상황을 분석하고, 팀원들과 함께 해결책을 모색하여 성공적으로 프로젝트를 마무리한 경험이 있습니다. 이러한 경험은 저에게 책임감을 더욱 강화시켰고, 지속적인 성장의 기회를 제공했습니다. 앞으로도 이러한 특장점을 바탕으로 조직에 기여하며 함께 발전해 나가고자 합니다.","저는 다양한 경험을 통해 쌓은 팀워크와 문제 해결 능력을 강점으로 삼고 있습니다. 대학 시절, 여러 프로젝트에서 팀원으로 활동하며 서로의 의견을 존중하고 조율하는 과정에서 협업의 중요성을 깨달았습니다. 또한, 예상치 못한 문제에 직면했을 때는 침착하게 상황을 분석하고, 팀원들과 함께 해결책을 모색하여 성공적으로 프로젝트를 마무리한 경험이 있습니다. 이러한 경험은 저에게 책임감을 더욱 강화시켰고, 지속적인 성장의 기회를 제공했습니다. 앞으로도 이러한 특장점을 바탕으로 조직에 기여하며 함께 발전해 나가고자 합니다.","저는 가족과의 소중한 유대감을 통해 팀워크와 책임감의 중요성을 배웠습니다. 부모님은 항상 저에게 자신감을 주셨고, 형제자매와 함께 성장하며 서로의 문제를 함께 해결하는 법을 익혔습니다. 이러한 경험은 저의 인생에 큰 영향을 미쳤고, 협력의 가치를 깨닫게 해주었습니다. 가족은 저에게 도전과 어려움을 극복하는 힘을 주었으며, 그 과정에서 저는 더 나은 사람으로 성장할 수 있었습니다. 앞으로도 가족과의 관계를 바탕으로, 다양한 사람들과의 협업에서 긍정적인 영향을 미치며 함께 발전해 나가고 싶습니다.","학창 시절, 다양한 활동을 통해 팀워크와 문제 해결 능력을 키웠습니다. 특히, 학급 대표로서 여러 프로젝트를 진행하며 친구들과 협력해 목표를 달성하는 기쁨을 느꼈습니다. 이러한 경험은 저에게 책임감을 심어주었고, 어려운 상황에서도 해결책을 찾는 데 집중할 수 있는 힘을 주었습니다. 또한, 동아리 활동을 통해 서로 다른 의견을 존중하고 조율하는 방법을 배우며 성장할 수 있었습니다. 이 모든 경험은 저의 인성과 능력을 발전시키는 데 큰 도움이 되었고, 앞으로의 도전에서도 이러한 배움을 바탕으로 성과를 이루고자 합니다.","다양한 경험을 통해 문제 해결 능력과 팀워크의 중요성을 깊이 이해하게 되었습니다. 대학 시절, 여러 프로젝트에서 팀원으로 참여하며 각자의 의견을 존중하고 조율하는 과정을 통해 협력의 가치를 실감했습니다. 특히, 예기치 않은 문제에 직면했을 때는 팀원들과 함께 brainstorming을 통해 창의적인 해결책을 도출하며 성장했습니다. 또한, 책임감을 가지고 맡은 역할을 수행하며 팀의 목표 달성에 기여한 경험은 저에게 큰 자산이 되었습니다. 앞으로도 끊임없이 배우고 성장하며, 팀과 함께 더 나은 결과를 만들어가는 일에 최선을 다할 것입니다.","저는 다양한 경험을 통해 쌓은 팀워크와 문제 해결 능력을 강점으로 삼고 있습니다. 대학 시절, 여러 프로젝트에서 팀원으로 활동하며 서로의 의견을 존중하고 조율하는 과정에서 협업의 중요성을 깨달았습니다. 또한, 예상치 못한 문제에 직면했을 때는 침착하게 상황을 분석하고, 팀원들과 함께 해결책을 모색하여 성공적으로 프로젝트를 마무리한 경험이 있습니다. 이러한 경험은 저에게 책임감을 더욱 강화시켰고, 지속적인 성장의 기회를 제공했습니다. 앞으로도 이러한 특장점을 바탕으로 조직에 기여하며 함께 발전해 나가고자 합니다.","학창 시절, 다양한 활동을 통해 팀워크와 문제 해결 능력을 키웠습니다. 특히, 학급 대표로서 여러 프로젝트를 진행하며 친구들과 협력해 목표를 달성하는 기쁨을 느꼈습니다. 이러한 경험은 저에게 책임감을 심어주었고, 어려운 상황에서도 해결책을 찾는 데 집중할 수 있는 힘을 주었습니다. 또한, 동아리 활동을 통해 서로 다른 의견을 존중하고 조율하는 방법을 배우며 성장할 수 있었습니다. 이 모든 경험은 저의 인성과 능력을 발전시키는 데 큰 도움이 되었고, 앞으로의 도전에서도 이러한 배움을 바탕으로 성과를 이루고자 합니다.","저는 다양한 경험을 통해 쌓은 팀워크와 문제 해결 능력을 강점으로 삼고 있습니다. 대학 시절, 여러 프로젝트에서 팀원으로 활동하며 서로의 의견을 존중하고 조율하는 과정에서 협업의 중요성을 깨달았습니다. 또한, 예상치 못한 문제에 직면했을 때는 침착하게 상황을 분석하고, 팀원들과 함께 해결책을 모색하여 성공적으로 프로젝트를 마무리한 경험이 있습니다. 이러한 경험은 저에게 책임감을 더욱 강화시켰고, 지속적인 성장의 기회를 제공했습니다. 앞으로도 이러한 특장점을 바탕으로 조직에 기여하며 함께 발전해 나가고자 합니다.",,,,,,2022-07,2022-07,2022-07,2022-07,2022-07,2022-07,2022-07,0,0,0,0.0,0.0,0.0,0.0,69437972902564021,06972709895833868,01442924710502114,06972709895833868,00667490271852068,55497742190313136,10409635691446214,3,4,2,7.0,5.0,5.0,4.0,CNC 선반 가공 실습,시설경비 실무,[경비지도사] 1차,시설경비 실무,건축도장 기능사 취득과정,웹디자인(포토샵·일러스트),요양보호사 이론·실습,1401,529,1240,130.0,261.0,333.0,1693.0,1235,660,1177,233.0,241.0,201.0,1668.0,5332301,7027734,7539428,6578835,5580995,5556221,9982369,2346,5011,5834,5123,5519,4572,7333,1,2,3,4.0,5.0,6.0,7.0,868,868,868,868.0,868.0,868.0,868.0,2022-07,2022-07,,,,5208322,5531896,,,,전산세무 2급,산업안전기사,,,,회계/세무,안전관리,,,,868,868,,,
